{
  "kind": "manifest",
  "dependencies": {
    "eth_firehose": "_/eth_firehose@0.0.0"
  },
  "tables": {
    "erc20_transfers": {
      "input": {
        "sql": "SELECT block_num, miner, hash, parent_hash FROM eth_firehose.blocks"
      },
      "schema": {
        "arrow": {
          "fields": [
            {
              "name": "_block_num",
              "type": "UInt64",
              "nullable": false
            },
            {
              "name": "block_num",
              "type": "UInt64",
              "nullable": false
            },
            {
              "name": "miner",
              "type": {
                "FixedSizeBinary": 20
              },
              "nullable": false
            },
            {
              "name": "hash",
              "type": {
                "FixedSizeBinary": 32
              },
              "nullable": false
            },
            {
              "name": "parent_hash",
              "type": {
                "FixedSizeBinary": 32
              },
              "nullable": false
            }
          ]
        }
      }
    }
  },
  "functions": {}
}
